{
  "$schema": "https://json-schema.org/draft/2020-12/schema",
  "$id": "progress.schema.json",
  "title": "Progress checklist",
  "description": "Milestones → tasks → steps. Percentages are never stored; the page works them out from step statuses.",
  "type": "object",
  "required": [
    "milestones"
  ],
  "additionalProperties": false,
  "properties": {
    "$schema": {
      "type": "string"
    },
    "title": {
      "type": "string",
      "description": "Page heading."
    },
    "subtitle": {
      "type": "string",
      "description": "One line under the heading."
    },
    "language": {
      "type": "string",
      "pattern": "^[a-z]{2,3}$",
      "description": "The language the file is written in; English when missing. Translations sit next to the file as <name>.<language>.json."
    },
    "updated": {
      "type": "string",
      "format": "date",
      "description": "Date of the last edit, YYYY-MM-DD."
    },
    "milestones": {
      "type": "array",
      "items": {
        "type": "object",
        "required": [
          "id",
          "name",
          "tasks"
        ],
        "additionalProperties": false,
        "properties": {
          "id": {
            "type": "string",
            "description": "Short label, e.g. M0."
          },
          "name": {
            "type": "string"
          },
          "when": {
            "type": "string",
            "description": "Free text, e.g. weeks 1–4."
          },
          "weight": {
            "type": "number",
            "minimum": 0,
            "description": "Share of the whole project, e.g. planned weeks. Defaults to 1."
          },
          "exit": {
            "type": "string",
            "description": "What must be true for the milestone to count as done."
          },
          "tasks": {
            "type": "array",
            "items": {
              "type": "object",
              "required": [
                "name",
                "steps"
              ],
              "additionalProperties": false,
              "properties": {
                "name": {
                  "type": "string"
                },
                "type": {
                  "enum": [
                    "feature",
                    "bug",
                    "issue",
                    "refinement",
                    "redesign",
                    "chore",
                    "docs",
                    "research",
                    "security"
                  ],
                  "description": "What kind of work the task is."
                },
                "tags": {
                  "type": "array",
                  "maxItems": 10,
                  "uniqueItems": true,
                  "items": {
                    "type": "string",
                    "pattern": "^[p{Ll}p{Lo}p{N}](?:[p{Ll}p{Lo}p{N}-]{0,28}[p{Ll}p{Lo}p{N}])?$"
                  },
                  "description": "Lower case, no spaces; for grouping and filtering."
                },
                "note": {
                  "type": "string",
                  "description": "Shown under the task, e.g. why a step is blocked."
                },
                "steps": {
                  "type": "array",
                  "items": {
                    "type": "object",
                    "required": [
                      "status",
                      "title"
                    ],
                    "additionalProperties": false,
                    "properties": {
                      "status": {
                        "enum": [
                          "done",
                          "review",
                          "doing",
                          "blocked",
                          "todo"
                        ],
                        "description": "done · review (waiting for your check) · doing · blocked (give a reason) · todo"
                      },
                      "title": {
                        "type": "string"
                      },
                      "reason": {
                        "type": "string",
                        "description": "Why the step is blocked."
                      }
                    }
                  }
                },
                "questions": {
                  "type": "array",
                  "items": {
                    "type": "object",
                    "required": [
                      "q"
                    ],
                    "additionalProperties": false,
                    "properties": {
                      "q": {
                        "type": "string"
                      },
                      "a": {
                        "type": "string"
                      }
                    }
                  }
                },
                "docs": {
                  "type": "array",
                  "items": {
                    "anyOf": [
                      {
                        "type": "string"
                      },
                      {
                        "type": "object",
                        "required": [
                          "path"
                        ],
                        "additionalProperties": false,
                        "properties": {
                          "title": {
                            "type": "string"
                          },
                          "path": {
                            "type": "string",
                            "description": "Path inside the project, optionally with #anchor."
                          }
                        }
                      }
                    ]
                  }
                },
                "blocked": {
                  "type": "string",
                  "description": "Why the whole task is blocked."
                }
              }
            }
          },
          "docs": {
            "type": "array",
            "items": {
              "anyOf": [
                {
                  "type": "string"
                },
                {
                  "type": "object",
                  "required": [
                    "path"
                  ],
                  "additionalProperties": false,
                  "properties": {
                    "title": {
                      "type": "string"
                    },
                    "path": {
                      "type": "string",
                      "description": "Path inside the project, optionally with #anchor."
                    }
                  }
                }
              ]
            }
          },
          "blocked": {
            "type": "string",
            "description": "Why the whole milestone is blocked."
          }
        }
      }
    },
    "docs": {
      "type": "array",
      "items": {
        "anyOf": [
          {
            "type": "string"
          },
          {
            "type": "object",
            "required": [
              "path"
            ],
            "additionalProperties": false,
            "properties": {
              "title": {
                "type": "string"
              },
              "path": {
                "type": "string",
                "description": "Path inside the project, optionally with #anchor."
              }
            }
          }
        ]
      }
    },
    "root": {
      "type": "string",
      "description": "File mode only: path from this page to the project root (default ../../)."
    }
  }
}
